{
  "meta": {
    "slug": "sucesion",
    "titulo": "Sucesión sin urnas",
    "subtitulo": "Tres hombres, un aparato: cómo se ha transferido el poder en Cuba desde 1959 — y por qué un hilo viral que lo explica con teología y psicología usa la herramienta equivocada.",
    "descripcion": "Este expediente documenta un hecho institucional, no una tesis psicológica: cómo se ha transferido el poder en Cuba en tres ocasiones desde 1959, y qué se mantuvo intacto cada vez que cambió el nombre en la cúpula. Nace de un hilo viral que intentaba explicar el \"caudillismo\" latinoamericano —agrupando a Fidel Castro junto a Perón, Chávez, Maduro, Rosas y Santa Anna bajo una sola categoría psicológica— mediante el \"Locus de Control\" de Julian Rotter y la tesis de Max Weber sobre protestantismo y capitalismo. Ninguna de esas dos herramientas explica lo que de verdad ocurrió en Cuba, y este expediente lo demuestra con los hechos, no con el armazón teórico.\n\nEl Locus de Control es un constructo psicológico validado a nivel individual: mide cómo una persona atribuye la causalidad de su propia vida. Rotter nunca lo propuso como explicación de instituciones o culturas nacionales enteras; esa extensión es de quien escribió el hilo, no del autor original. La tesis de Weber, por su parte, sigue disputada en las propias ciencias sociales un siglo después de publicada: se le critica no considerar las condiciones materiales previas y hay estudios cuantitativos recientes con resultados negativos. Y la literatura académica especializada en caudillismo latinoamericano distingue explícitamente el caudillismo federal del siglo XIX, el populismo clásico de Perón, el neopopulismo de Chávez y Maduro, y la revolución socialista de partido único cubana como fenómenos políticos distintos —no una sola categoría psicológica intercambiable.\n\nLo que sí es verificable, y es el cuerpo de este expediente, son tres transferencias de poder documentadas con fecha y mecanismo. Fidel Castro encabezó el Estado cubano desde 1959 hasta que delegó sus cargos por enfermedad el 31 de julio de 2006, y el Partido Comunista de Cuba hasta su VI Congreso en abril de 2011. Raúl Castro asumió como presidente en funciones ese mismo 31 de julio de 2006 y fue formalizado por la Asamblea Nacional del Poder Popular el 24 de febrero de 2008, sin competencia partidaria; asumió la jefatura del PCC en 2011 y la conservó tres años después de ceder la presidencia del Estado a Miguel Díaz-Canel el 19 de abril de 2018, hasta entregarla en el VII Congreso de abril de 2021. Díaz-Canel es, desde 2018, el primer jefe de Estado cubano sin el apellido Castro desde el triunfo revolucionario.\n\nEn ninguna de las tres transiciones hubo una elección competitiva entre partidos ni una candidatura alternativa: el mecanismo fue siempre la designación indirecta por una Asamblea Nacional de partido único. Y en las tres, dos instituciones permanecieron intactas por debajo del cambio de rostro: el Partido Comunista de Cuba como único partido legal, y el control del aparato militar (las Fuerzas Armadas Revolucionarias y su brazo económico) en manos de la misma cúpula. El dato que mejor desmonta cualquier lectura psicológica individual es estructural: durante tres años, entre 2018 y 2021, Cuba tuvo un jefe de Estado que no encabezaba el partido que de verdad concentra el poder. Eso no lo explica el temperamento de nadie; lo explica el diseño de las instituciones.\n\nEste expediente no evalúa ni respalda el Locus de Control ni la tesis weberiana como explicaciones válidas de Cuba: las presenta como lo que son, un armazón teórico tomado fuera de su alcance, y las contrasta con los hechos verificables. La única afirmación que se sostiene aquí como hecho es la continuidad institucional de 1959 a 2026.",
    "narracion": "Este expediente documenta un hecho institucional, no una teoría psicológica: cómo se ha transferido el poder en Cuba tres veces desde mil novecientos cincuenta y nueve. Nace de un hilo viral que explicaba el caudillismo latinoamericano con el Locus de Control de Julian Rotter y la tesis de Max Weber sobre protestantismo y capitalismo. Ninguna de las dos herramientas explica Cuba. Rotter mide personas individuales, no naciones enteras. La tesis de Weber sigue disputada un siglo después de publicada. Y la literatura académica sobre caudillismo distingue el caudillismo del siglo diecinueve, el populismo clásico, el neopopulismo y la revolución socialista cubana como fenómenos distintos, no una sola categoría psicológica. Lo verificable son tres transferencias con fecha exacta. Fidel Castro encabezó el Estado desde mil novecientos cincuenta y nueve hasta que delegó el poder por enfermedad, el treinta y uno de julio de dos mil seis. Raúl Castro fue formalizado presidente el veinticuatro de febrero de dos mil ocho, sin competencia partidaria, y entregó la presidencia a Miguel Díaz-Canel en dos mil dieciocho, pero conservó la jefatura del partido tres años más. En ninguna transición hubo elección competitiva entre partidos. Lo que permaneció fue el partido único y el control militar. Eso no lo explica ninguna psicología individual: lo explica el diseño de las instituciones.",
    "version": "1.0.0",
    "fecha_datos": "2026-07-22",
    "advertencia": "Este expediente no evalúa ni respalda el Locus de Control de Rotter ni la tesis weberiana como explicación causal de la política cubana: los presenta como el armazón teórico de un hilo viral, tomado fuera de su alcance original, y los contrasta con los hechos institucionales verificables. La única afirmación que este expediente sostiene como hecho es la continuidad institucional del poder en Cuba entre 1959 y 2026."
  },
  "intro": {
    "parrafos": [
      "Un hilo viral reciente proponía que la diferencia entre sociedades \"que confían en las instituciones\" y sociedades \"que esperan un salvador\" es psicológica y teológica: el Locus de Control de Julian Rotter, heredado del protestantismo frente al catolicismo. Como ilustración incluía, en una misma lista, a Rosas, Santa Anna, Perón, Chávez, Maduro, Fidel Castro, Raúl Castro y Miguel Díaz-Canel.",
      "Ese marco tiene un problema doble. Rotter nunca diseñó su constructo para explicar naciones enteras: mide cómo una persona atribuye la causalidad de su propia vida, no cómo funciona un Estado. Y la tesis de Weber que el hilo invoca sigue disputada en las propias ciencias sociales un siglo después de publicada. Ninguna de las dos es la herramienta correcta para explicar lo que de verdad ocurrió en Cuba.",
      "Lo que sí explica Cuba son los hechos institucionales: tres transferencias de poder documentadas, con fecha y mecanismo, en las que cambió el rostro pero no el aparato. Este expediente reconstruye esas tres transiciones y, al final, muestra por qué agrupar a Fidel Castro con Perón o Chávez bajo una sola etiqueta psicológica borra distinciones que la propia literatura académica sobre caudillismo sí sostiene."
    ]
  },
  "eras": [
    {
      "id": "fidel",
      "lider": "Fidel Castro",
      "periodo_texto": "1959–2006 al frente del Estado (47 años); hasta 2011 al frente del partido",
      "cargo_estado": {
        "inicio": "1959 (primer ministro); 1976 (presidente del Consejo de Estado)",
        "fin": "31-jul-2006 (delegación por enfermedad)",
        "detalle": "Encabezó el gobierno cubano de forma ininterrumpida desde el triunfo revolucionario de enero de 1959 hasta que delegó sus cargos de forma provisional por motivos de salud el 31 de julio de 2006."
      },
      "cargo_pcc": {
        "inicio": "1965 (fundación del Partido Comunista de Cuba)",
        "fin": "19-abr-2011 (VI Congreso del PCC)",
        "detalle": "Primer secretario del Partido Comunista de Cuba desde su fundación en 1965 hasta que cedió formalmente el cargo a Raúl Castro en el VI Congreso, celebrado en abril de 2011."
      },
      "mecanismo": "Ninguna elección competitiva ni pluralismo partidario en ningún momento de su mandato; liderazgo consolidado desde el triunfo revolucionario y el aparato de partido único.",
      "confianza": "corroborada",
      "fuente": "Registro histórico consistente (Britannica, cobertura contemporánea de la Revolución cubana y del VI Congreso del PCC, 2011)"
    },
    {
      "id": "raul",
      "lider": "Raúl Castro",
      "periodo_texto": "2006–2021, combinando jefatura del Estado (hasta 2018) y del partido (hasta 2021): 15 años",
      "cargo_estado": {
        "inicio": "31-jul-2006 (transición provisional por delegación)",
        "fin": "19-abr-2018 (cede la presidencia a Díaz-Canel)",
        "detalle": "Asumió como presidente en funciones el 31 de julio de 2006 por delegación de Fidel Castro. Fue formalizado como presidente del Consejo de Estado el 24 de febrero de 2008 mediante elección indirecta de la Asamblea Nacional del Poder Popular, sin competencia partidaria ni candidatura alternativa."
      },
      "cargo_pcc": {
        "inicio": "19-abr-2011 (VI Congreso del PCC)",
        "fin": "19-abr-2021 (VII Congreso del PCC)",
        "detalle": "Asumió la jefatura del partido en abril de 2011 y la conservó tres años después de haber cedido la presidencia del Estado a Díaz-Canel en 2018, hasta entregarla formalmente en el VII Congreso de abril de 2021."
      },
      "mecanismo": "Designación indirecta por la Asamblea Nacional del Poder Popular, sin elección competitiva entre partidos ni candidaturas alternativas; mismo mecanismo institucional que la transición de 1959.",
      "confianza": "corroborada",
      "fuente": "Cobertura histórica consistente sobre la transferencia de funciones presidenciales 2006–2008 y las actas del VI y VII Congreso del PCC"
    },
    {
      "id": "diaz_canel",
      "lider": "Miguel Díaz-Canel",
      "periodo_texto": "2018–presente al frente del Estado; desde 2021 al frente del partido (en curso)",
      "cargo_estado": {
        "inicio": "19-abr-2018",